{
  "$schema":"https://json-schema.org/draft/2020-12/schema",
  "$id":"bopen://schemas/governance/technology-decision-assignment/0.1.0-draft",
  "status":"draft","title":"bOPEN Technology Decision Assignments","type":"object",
  "required":["$schema","register_id","version","status","owner_authority","updated_at","entries"],
  "properties":{"$schema":{"const":"bopen://schemas/governance/technology-decision-assignment/0.1.0-draft"},"register_id":{"type":"string","pattern":"^PG-REG-TECH-[0-9]{3}$"},"version":{"type":"string","pattern":"^[0-9]+\\.[0-9]+\\.[0-9]+(?:-draft)?$"},"status":{"enum":["draft","approved"]},"owner_authority":{"type":"string","minLength":1},"updated_at":{"type":"string","format":"date-time"},"approved_by":{"type":["string","null"],"minLength":1},"approved_at":{"type":["string","null"],"format":"date-time"},"approval_ref":{"type":["string","null"],"minLength":1},"entries":{"type":"array","minItems":1,"items":{"type":"object","required":["assignment_id","decision_id","subject","status","owner_authority","checker_authorities","required_before_phase","due_at","evidence_refs","blockers"],"properties":{"assignment_id":{"type":"string","pattern":"^TECH-[0-9]{3}$"},"decision_id":{"type":"string","pattern":"^(?:DEC|ADR)-[0-9]{4}$"},"subject":{"type":"string","minLength":1},"status":{"enum":["PENDING_OWNER_ASSIGNED","READY_FOR_REVIEW","DECIDED","BLOCKED","RETIRED"]},"owner_authority":{"type":"string","minLength":1},"checker_authorities":{"type":"array","items":{"type":"string","minLength":1},"uniqueItems":true},"required_before_phase":{"type":"string","pattern":"^PG-(?:G|P|C)[0-9]+$"},"due_at":{"type":["string","null"],"format":"date-time"},"evidence_refs":{"type":"array","items":{"type":"string","minLength":1},"minItems":1,"uniqueItems":true},"blockers":{"type":"array","items":{"type":"string","minLength":1},"uniqueItems":true}},"additionalProperties":false}}},
  "additionalProperties":false
}
