{
  "$schema": "bopen://schemas/governance/technology-decision-assignment/0.1.0-draft",
  "register_id": "PG-REG-TECH-001",
  "version": "0.1.0",
  "status": "approved",
  "owner_authority": "Architecture Authority",
  "updated_at": "2026-07-23T00:45:00+07:00",
  "approved_by": "HUMAN-OPERATOR-001",
  "approved_at": "2026-07-23T00:45:00+07:00",
  "approval_ref": "docs/00-governance/signing/SIGNING-PASS-2.md#append-only-batch-2-signing-record--2026-07-23",
  "entries": [
    {
      "assignment_id": "TECH-001",
      "decision_id": "DEC-0004",
      "subject": "Production technology stack",
      "status": "READY_FOR_REVIEW",
      "owner_authority": "Architecture Authority",
      "checker_authorities": [
        "BST-Codex-Motor (independent technical checker)"
      ],
      "required_before_phase": "PG-P0",
      "due_at": "2026-08-21T00:00:00+07:00",
      "evidence_refs": [
        "docs/decisions/DECISION-REGISTER.md",
        "docs/00-governance/signing/SIGNING-PASS-1.md"
      ],
      "blockers": []
    },
    {
      "assignment_id": "TECH-002",
      "decision_id": "DEC-0005",
      "subject": "Identity provider and integration strategy",
      "status": "READY_FOR_REVIEW",
      "owner_authority": "Security/Architecture Authorities",
      "checker_authorities": [
        "BST-Codex-Motor (independent technical checker)"
      ],
      "required_before_phase": "PG-P0",
      "due_at": "2026-08-21T00:00:00+07:00",
      "evidence_refs": [
        "docs/decisions/DECISION-REGISTER.md",
        "docs/00-governance/signing/SIGNING-PASS-1.md"
      ],
      "blockers": []
    },
    {
      "assignment_id": "TECH-003",
      "decision_id": "ADR-0005",
      "subject": "Pooled PostgreSQL and row-level security candidate",
      "status": "READY_FOR_REVIEW",
      "owner_authority": "Architecture Authority",
      "checker_authorities": [
        "BST-Codex-Motor (independent technical checker)"
      ],
      "required_before_phase": "PG-P0",
      "due_at": "2026-08-21T00:00:00+07:00",
      "evidence_refs": [
        "docs/adr/ADR-0005.md",
        "docs/00-governance/signing/SIGNING-PASS-1.md"
      ],
      "blockers": []
    },
    {
      "assignment_id": "TECH-004",
      "decision_id": "ADR-0009",
      "subject": "Modular-monolith runtime topology candidate",
      "status": "READY_FOR_REVIEW",
      "owner_authority": "Architecture Authority",
      "checker_authorities": [
        "BST-Codex-Motor (independent technical checker)"
      ],
      "required_before_phase": "PG-P0",
      "due_at": "2026-08-21T00:00:00+07:00",
      "evidence_refs": [
        "docs/adr/ADR-0009.md",
        "docs/00-governance/signing/SIGNING-PASS-1.md"
      ],
      "blockers": []
    }
  ]
}
